{
  "$schema": "https://json-schema.org/draft/2020-12/schema",
  "$id": "https://example.invalid/svgdiff/schema/1.0",
  "title": "SVG Diff Structured Report 1.0",
  "type": "object",
  "required": [
    "schema_version",
    "analysis_status",
    "profile",
    "subject_alignments",
    "changed_facts",
    "source_resolutions",
    "atomic_differences",
    "events",
    "diagnostics"
  ],
  "properties": {
    "schema_version": { "const": "1.0" },
    "analysis_status": { "enum": ["complete", "partial", "failed"] },
    "coverage_matrix": {
      "type": "array",
      "items": { "$ref": "#/$defs/featureCoverage" }
    },
    "renderer_capability_gaps": {
      "type": "array",
      "items": { "$ref": "#/$defs/rendererCapabilityGap" }
    },
    "profile": {
      "type": "object",
      "required": [
        "viewport_width",
        "viewport_height",
        "comparison_dpr",
        "color_interpretation",
        "raster_representation",
        "renderer_id"
      ],
      "properties": {
        "viewport_width": { "type": "integer", "minimum": 1 },
        "viewport_height": { "type": "integer", "minimum": 1 },
        "comparison_dpr": { "const": 1.0 },
        "color_interpretation": { "const": "srgb" },
        "raster_representation": {
          "const": "linear_srgb_premultiplied_rgba_f64"
        },
        "renderer_id": { "const": "mizchi/svg@0.2.1" },
        "renderer_conformance_profile_id": {
          "const": "svgdiff-renderer-conformance-profile/1"
        }
      }
    },
    "subject_alignments": {
      "type": "array",
      "items": { "$ref": "#/$defs/subjectAlignment" }
    },
    "changed_facts": {
      "type": "array",
      "items": { "$ref": "#/$defs/changedFact" }
    },
    "source_resolutions": { "type": "array" },
    "atomic_differences": {
      "type": "array",
      "items": { "$ref": "#/$defs/atomicDifference" }
    },
    "events": {
      "type": "array",
      "items": { "$ref": "#/$defs/visualEvent" }
    },
    "diagnostics": {
      "type": "array",
      "items": { "$ref": "#/$defs/diagnostic" }
    }
  },
  "$defs": {
    "featureCoverage": {
      "type": "object",
      "required": [
        "feature_id",
        "subject_id",
        "source_semantics",
        "computed_appearance",
        "rendered_evidence",
        "diagnostic_ids"
      ],
      "properties": {
        "feature_id": { "type": "string" },
        "subject_id": { "type": "string" },
        "source_semantics": {
          "enum": ["covered", "limited", "not_applicable", "failed"]
        },
        "computed_appearance": {
          "enum": ["covered", "limited", "not_applicable", "failed"]
        },
        "rendered_evidence": {
          "enum": ["covered", "limited", "not_applicable", "failed"]
        },
        "diagnostic_ids": {
          "type": "array",
          "items": { "type": "string" }
        }
      }
    },
    "rendererCapabilityGap": {
      "type": "object",
      "required": ["capability_id", "support_status", "diagnostic_ids"],
      "properties": {
        "capability_id": { "type": "string", "minLength": 1 },
        "support_status": { "enum": ["guarded", "unavailable"] },
        "diagnostic_ids": {
          "type": "array",
          "minItems": 1,
          "items": { "type": "string" }
        }
      }
    },
    "nullableString": { "type": ["string", "null"] },
    "nullableNumber": { "type": ["number", "null"] },
    "sourceSpan": {
      "type": "object",
      "required": ["start_offset", "end_offset"],
      "properties": {
        "start_offset": { "type": "integer", "minimum": 0 },
        "end_offset": { "type": "integer", "minimum": 0 }
      }
    },
    "declaredFact": {
      "type": ["object", "null"],
      "properties": {
        "property": { "type": "string" },
        "authored_value": { "type": "string" },
        "declared_value": { "type": "string" },
        "origin": { "type": "string" },
        "source_span": { "$ref": "#/$defs/sourceSpan" }
      }
    },
    "nullableDeclaredFact": {
      "anyOf": [
        { "$ref": "#/$defs/declaredFact" },
        { "type": "null" }
      ]
    },
    "subjectReference": {
      "type": "object",
      "required": ["source_index", "kind", "authored_id"],
      "properties": {
        "source_index": { "type": "integer", "minimum": 0 },
        "kind": { "type": "string" },
        "authored_id": { "$ref": "#/$defs/nullableString" }
      }
    },
    "subjectAlignment": {
      "type": "object",
      "required": ["id", "relation", "before", "after", "basis"],
      "properties": {
        "id": { "type": "string" },
        "relation": { "enum": ["correspondence", "insertion", "deletion", "split", "merge"] },
        "before": { "type": "array", "items": { "$ref": "#/$defs/subjectReference" } },
        "after": { "type": "array", "items": { "$ref": "#/$defs/subjectReference" } },
        "basis": { "type": "string" }
      }
    },
    "changedFact": {
      "type": "object",
      "required": ["id", "subject_id", "property", "before", "after", "affected_subject_ids"],
      "properties": {
        "id": { "type": "string" },
        "subject_id": { "type": "string" },
        "property": { "type": "string" },
        "before": { "$ref": "#/$defs/nullableDeclaredFact" },
        "after": { "$ref": "#/$defs/nullableDeclaredFact" },
        "affected_subject_ids": { "type": "array", "items": { "type": "string" } }
      }
    },
    "magnitude": {
      "type": "object",
      "required": [
        "parameter_abs_user_units",
        "parameter_signed_user_units",
        "symmetric_relative",
        "geometry_displacement_css_px",
        "geometry_viewport_fraction",
        "presence_painted_viewport_fraction",
        "raster_changed_pixel_fraction",
        "raster_rgba8_rmse",
        "raster_linear_premultiplied_rgba_rmse"
      ],
      "additionalProperties": { "$ref": "#/$defs/nullableNumber" }
    },
    "atomicDifference": {
      "type": "object",
      "required": [
        "id",
        "subject_role",
        "subject_alignment_id",
        "domain",
        "changed_fact_ids",
        "evidence_layers",
        "computed_relation",
        "magnitude",
        "domain_ordering"
      ],
      "properties": {
        "id": { "type": "string" },
        "subject_role": { "enum": ["entity", "resource"] },
        "subject_alignment_id": { "$ref": "#/$defs/nullableString" },
        "domain": { "type": "string" },
        "changed_fact_ids": { "type": "array", "items": { "type": "string" } },
        "evidence_layers": { "type": "array", "items": { "type": "string" } },
        "computed_relation": { "type": "object" },
        "magnitude": { "$ref": "#/$defs/magnitude" },
        "domain_ordering": {
          "type": "object",
          "required": ["policy_id", "components"],
          "properties": {
            "policy_id": { "const": "v1_domain_lexicographic" },
            "components": { "type": "array", "items": { "type": "number" } }
          }
        }
      }
    },
    "causeEnvelope": {
      "type": "object",
      "required": ["guarantee", "coverage", "fallback_scope", "candidate_changed_fact_ids", "diagnostic_ids"],
      "properties": {
        "guarantee": { "enum": ["sound_overapproximation", "not_established"] },
        "coverage": { "enum": ["complete", "partial"] },
        "fallback_scope": { "enum": ["comparison", "event_region"] },
        "candidate_changed_fact_ids": { "type": "array", "items": { "type": "string" } },
        "diagnostic_ids": { "type": "array", "items": { "type": "string" } }
      }
    },
    "differenceRegion": {
      "type": "object",
      "required": ["id", "source", "pixel_x", "pixel_y", "pixel_width", "pixel_height", "css_x", "css_y", "css_width", "css_height", "changed_pixels", "viewport_fraction", "cause_envelope"],
      "properties": {
        "id": { "type": "string" },
        "source": { "enum": ["pixel_mask", "computed_bounds"] },
        "pixel_x": { "type": "integer" },
        "pixel_y": { "type": "integer" },
        "pixel_width": { "type": "integer", "minimum": 0 },
        "pixel_height": { "type": "integer", "minimum": 0 },
        "css_x": { "type": "number" },
        "css_y": { "type": "number" },
        "css_width": { "type": "number", "minimum": 0 },
        "css_height": { "type": "number", "minimum": 0 },
        "changed_pixels": { "type": "integer", "minimum": 0 },
        "viewport_fraction": { "type": "number", "minimum": 0 },
        "cause_envelope": { "$ref": "#/$defs/causeEnvelope" }
      }
    },
    "visualEvent": {
      "type": "object",
      "required": ["id", "primary_subject_id", "atomic_difference_ids", "rendered_outcome", "difference_regions"],
      "properties": {
        "id": { "type": "string" },
        "primary_subject_id": { "type": "string" },
        "atomic_difference_ids": { "type": "array", "items": { "type": "string" } },
        "rendered_outcome": { "type": "object" },
        "difference_regions": { "type": "array", "items": { "$ref": "#/$defs/differenceRegion" } }
      }
    },
    "diagnostic": {
      "type": "object",
      "required": ["id", "code", "subject_id", "affected_evidence_layers"],
      "properties": {
        "id": { "type": "string" },
        "code": { "type": "string" },
        "subject_id": { "type": "string" },
        "affected_evidence_layers": { "type": "array", "items": { "type": "string" } }
      }
    }
  }
}
